<?xml version='1.0' encoding='UTF-8'?>
<!DOCTYPE dataset SYSTEM "i2b2LoadTestData.dtd">
<dataset>
  <ARCHIVE_OBSERVATION_FACT/>
  <CONCEPT_DIMENSION/>
  <EK_REJECTED_OBSERVATION_FACT/>
  <EK_TEMP_CONCEPT CONCEPT_CD="DiastolicBloodPressure" CONCEPT_PATH="\EK\VitalSign\DiastolicBloodPressure\" NAME_CHAR="Diastolic Blood Pressure" UPDATE_DATE="1970-02-15" DOWNLOAD_DATE="1970-02-15" IMPORT_DATE="2015-05-07" SOURCESYSTEM_CD="edu.emory.cci.aiw.i2b2etl.ksb.I2b2KnowledgeSourceB"/>
  <EK_TEMP_CONCEPT CONCEPT_CD="HeartRate" CONCEPT_PATH="\EK\VitalSign\HeartRate\" NAME_CHAR="Heart Rate" UPDATE_DATE="1970-02-15" DOWNLOAD_DATE="1970-02-15" IMPORT_DATE="2015-05-07" SOURCESYSTEM_CD="edu.emory.cci.aiw.i2b2etl.ksb.I2b2KnowledgeSourceB"/>
  <EK_TEMP_CONCEPT CONCEPT_CD="SystolicBloodPressure" CONCEPT_PATH="\EK\VitalSign\SystolicBloodPressure\" NAME_CHAR="Systolic Blood Pressure" UPDATE_DATE="1970-02-15" DOWNLOAD_DATE="1970-02-15" IMPORT_DATE="2015-05-07" SOURCESYSTEM_CD="edu.emory.cci.aiw.i2b2etl.ksb.I2b2KnowledgeSourceB"/>
  <EK_TEMP_CONCEPT CONCEPT_CD="RespiratoryRate" CONCEPT_PATH="\EK\VitalSign\RespiratoryRate\" NAME_CHAR="Respiratory Rate" UPDATE_DATE="1970-02-15" DOWNLOAD_DATE="1970-02-15" IMPORT_DATE="2015-05-07" SOURCESYSTEM_CD="edu.emory.cci.aiw.i2b2etl.ksb.I2b2KnowledgeSourceB"/>
  <EK_TEMP_CONCEPT CONCEPT_CD="O2Saturation" CONCEPT_PATH="\EK\VitalSign\O2Saturation\" NAME_CHAR="Oxygen Saturation" UPDATE_DATE="1970-02-15" DOWNLOAD_DATE="1970-02-15" IMPORT_DATE="2015-05-07" SOURCESYSTEM_CD="edu.emory.cci.aiw.i2b2etl.ksb.I2b2KnowledgeSourceB"/>
  <EK_TEMP_CONCEPT CONCEPT_CD="BodyMassIndex" CONCEPT_PATH="\EK\VitalSign\BodyMassIndex\" NAME_CHAR="Body mass index" UPDATE_DATE="1970-02-15" DOWNLOAD_DATE="1970-02-15" IMPORT_DATE="2015-05-07" SOURCESYSTEM_CD="edu.emory.cci.aiw.i2b2etl.ksb.I2b2KnowledgeSourceB"/>
  <EK_TEMP_CONCEPT CONCEPT_CD="ICD9:72" CONCEPT_PATH="\EK\ICD9:Procedures\ICD9:72-75\ICD9:72\" NAME_CHAR="Forceps, vacuum, and breech delivery" UPDATE_DATE="1970-02-15" DOWNLOAD_DATE="1970-02-15" IMPORT_DATE="2015-05-07" SOURCESYSTEM_CD="edu.emory.cci.aiw.i2b2etl.ksb.I2b2KnowledgeSourceB"/>
  <EK_TEMP_CONCEPT CONCEPT_CD="ICD9:77" CONCEPT_PATH="\EK\ICD9:Procedures\ICD9:76-84\ICD9:77\" NAME_CHAR="Incision, excision, and division of other bones" UPDATE_DATE="1970-02-15" DOWNLOAD_DATE="1970-02-15" IMPORT_DATE="2015-05-07" SOURCESYSTEM_CD="edu.emory.cci.aiw.i2b2etl.ksb.I2b2KnowledgeSourceB"/>
  <EK_TEMP_CONCEPT CONCEPT_CD="LAB:8400010" CONCEPT_PATH="\EK\LAB:LabTest\LAB:Other\LAB:8400010\" NAME_CHAR="AP WHITE BLOOD CELL COUNT" UPDATE_DATE="1970-02-15" DOWNLOAD_DATE="1970-02-15" IMPORT_DATE="2015-05-07" SOURCESYSTEM_CD="edu.emory.cci.aiw.i2b2etl.ksb.I2b2KnowledgeSourceB"/>
  <EK_TEMP_CONCEPT CONCEPT_CD="LAB:8007694" CONCEPT_PATH="\EK\LAB:LabTest\LAB:Other\LAB:8007694\" NAME_CHAR="SC QM CODES AND STAINS" UPDATE_DATE="1970-02-15" DOWNLOAD_DATE="1970-02-15" IMPORT_DATE="2015-05-07" SOURCESYSTEM_CD="edu.emory.cci.aiw.i2b2etl.ksb.I2b2KnowledgeSourceB"/>
  <EK_TEMP_CONCEPT CONCEPT_CD="LAB:2000820" CONCEPT_PATH="\EK\LAB:LabTest\LAB:CBC\LAB:2000820\" NAME_CHAR="PLATELET CT" UPDATE_DATE="1970-02-15" DOWNLOAD_DATE="1970-02-15" IMPORT_DATE="2015-05-07" SOURCESYSTEM_CD="edu.emory.cci.aiw.i2b2etl.ksb.I2b2KnowledgeSourceB"/>
  <EK_TEMP_CONCEPT CONCEPT_CD="TemperatureCore" CONCEPT_PATH="\EK\VitalSign\Temperature\TemperatureCore\" NAME_CHAR="Temperature (C) Core" UPDATE_DATE="1970-02-15" DOWNLOAD_DATE="1970-02-15" IMPORT_DATE="2015-05-07" SOURCESYSTEM_CD="edu.emory.cci.aiw.i2b2etl.ksb.I2b2KnowledgeSourceB"/>
  <EK_TEMP_CONCEPT CONCEPT_CD="TemperatureAxillary" CONCEPT_PATH="\EK\VitalSign\Temperature\TemperatureAxillary\" NAME_CHAR="Temperature (C) Axillary" UPDATE_DATE="1970-02-15" DOWNLOAD_DATE="1970-02-15" IMPORT_DATE="2015-05-07" SOURCESYSTEM_CD="edu.emory.cci.aiw.i2b2etl.ksb.I2b2KnowledgeSourceB"/>
  <EK_TEMP_CONCEPT CONCEPT_CD="TemperatureNOS" CONCEPT_PATH="\EK\VitalSign\Temperature\TemperatureNOS\" NAME_CHAR="Temperature" UPDATE_DATE="1970-02-15" DOWNLOAD_DATE="1970-02-15" IMPORT_DATE="2015-05-07" SOURCESYSTEM_CD="edu.emory.cci.aiw.i2b2etl.ksb.I2b2KnowledgeSourceB"/>
  <EK_TEMP_CONCEPT CONCEPT_CD="TemperatureRectal" CONCEPT_PATH="\EK\VitalSign\Temperature\TemperatureRectal\" NAME_CHAR="Temperature (C) Rectal" UPDATE_DATE="1970-02-15" DOWNLOAD_DATE="1970-02-15" IMPORT_DATE="2015-05-07" SOURCESYSTEM_CD="edu.emory.cci.aiw.i2b2etl.ksb.I2b2KnowledgeSourceB"/>
  <EK_TEMP_CONCEPT CONCEPT_CD="TemperatureOral" CONCEPT_PATH="\EK\VitalSign\Temperature\TemperatureOral\" NAME_CHAR="Temperature (C) Oral" UPDATE_DATE="1970-02-15" DOWNLOAD_DATE="1970-02-15" IMPORT_DATE="2015-05-07" SOURCESYSTEM_CD="edu.emory.cci.aiw.i2b2etl.ksb.I2b2KnowledgeSourceB"/>
  <EK_TEMP_CONCEPT CONCEPT_CD="TemperatureTympanic" CONCEPT_PATH="\EK\VitalSign\Temperature\TemperatureTympanic\" NAME_CHAR="Temperature (C) Tympanic" UPDATE_DATE="1970-02-15" DOWNLOAD_DATE="1970-02-15" IMPORT_DATE="2015-05-07" SOURCESYSTEM_CD="edu.emory.cci.aiw.i2b2etl.ksb.I2b2KnowledgeSourceB"/>
  <EK_TEMP_CONCEPT CONCEPT_CD="ICD9:985" CONCEPT_PATH="\EK\ICD9:Diagnoses\ICD9:800-999\ICD9:960-989\ICD9:985\" NAME_CHAR="Toxic effect of other metals" UPDATE_DATE="1970-02-15" DOWNLOAD_DATE="1970-02-15" IMPORT_DATE="2015-05-07" SOURCESYSTEM_CD="edu.emory.cci.aiw.i2b2etl.ksb.I2b2KnowledgeSourceB"/>
  <EK_TEMP_CONCEPT CONCEPT_CD="ICD9:947" CONCEPT_PATH="\EK\ICD9:Diagnoses\ICD9:800-999\ICD9:940-949\ICD9:947\" NAME_CHAR="Burn of internal organs" UPDATE_DATE="1970-02-15" DOWNLOAD_DATE="1970-02-15" IMPORT_DATE="2015-05-07" SOURCESYSTEM_CD="edu.emory.cci.aiw.i2b2etl.ksb.I2b2KnowledgeSourceB"/>
  <EK_TEMP_CONCEPT CONCEPT_CD="ICD9:770.7" CONCEPT_PATH="\EK\ICD9:Diagnoses\ICD9:760-779\ICD9:770\ICD9:770.7\" NAME_CHAR="Wilson-Mikity syndrome" UPDATE_DATE="1970-02-15" DOWNLOAD_DATE="1970-02-15" IMPORT_DATE="2015-05-07" SOURCESYSTEM_CD="edu.emory.cci.aiw.i2b2etl.ksb.I2b2KnowledgeSourceB"/>
  <EK_TEMP_CONCEPT CONCEPT_CD="ICD9:66.9" CONCEPT_PATH="\EK\ICD9:Procedures\ICD9:65-71\ICD9:66\ICD9:66.9\" NAME_CHAR="Other operations on fallopian tubes" UPDATE_DATE="1970-02-15" DOWNLOAD_DATE="1970-02-15" IMPORT_DATE="2015-05-07" SOURCESYSTEM_CD="edu.emory.cci.aiw.i2b2etl.ksb.I2b2KnowledgeSourceB"/>
  <EK_TEMP_CONCEPT CONCEPT_CD="ICD9:48.5" CONCEPT_PATH="\EK\ICD9:Procedures\ICD9:42-54\ICD9:48\ICD9:48.5\" NAME_CHAR="Abdominoperineal resection of rectum" UPDATE_DATE="1970-02-15" DOWNLOAD_DATE="1970-02-15" IMPORT_DATE="2015-05-07" SOURCESYSTEM_CD="edu.emory.cci.aiw.i2b2etl.ksb.I2b2KnowledgeSourceB"/>
  <EK_TEMP_CONCEPT CONCEPT_CD="ICD9:74.9" CONCEPT_PATH="\EK\ICD9:Procedures\ICD9:72-75\ICD9:74\ICD9:74.9\" NAME_CHAR="Cesarean section of unspecified type" UPDATE_DATE="1970-02-15" DOWNLOAD_DATE="1970-02-15" IMPORT_DATE="2015-05-07" SOURCESYSTEM_CD="edu.emory.cci.aiw.i2b2etl.ksb.I2b2KnowledgeSourceB"/>
  <EK_TEMP_CONCEPT CONCEPT_CD="ICD9:96.2" CONCEPT_PATH="\EK\ICD9:Procedures\ICD9:87-99\ICD9:96\ICD9:96.2\" NAME_CHAR="Nonoperative dilation and manipulation" UPDATE_DATE="1970-02-15" DOWNLOAD_DATE="1970-02-15" IMPORT_DATE="2015-05-07" SOURCESYSTEM_CD="edu.emory.cci.aiw.i2b2etl.ksb.I2b2KnowledgeSourceB"/>
  <EK_TEMP_CONCEPT CONCEPT_CD="ICD9:92.2" CONCEPT_PATH="\EK\ICD9:Procedures\ICD9:87-99\ICD9:92\ICD9:92.2\" NAME_CHAR="Therapeutic radiology and nuclear medicine" UPDATE_DATE="1970-02-15" DOWNLOAD_DATE="1970-02-15" IMPORT_DATE="2015-05-07" SOURCESYSTEM_CD="edu.emory.cci.aiw.i2b2etl.ksb.I2b2KnowledgeSourceB"/>
  <EK_TEMP_CONCEPT CONCEPT_CD="ICD9:800.8" CONCEPT_PATH="\EK\ICD9:Diagnoses\ICD9:800-999\ICD9:800-804\ICD9:800\ICD9:800.8\" NAME_CHAR="Open fracture of vault of skull with other and unspecified intracranial hemorrhage" UPDATE_DATE="1970-02-15" DOWNLOAD_DATE="1970-02-15" IMPORT_DATE="2015-05-07" SOURCESYSTEM_CD="edu.emory.cci.aiw.i2b2etl.ksb.I2b2KnowledgeSourceB"/>
  <EK_TEMP_CONCEPT CONCEPT_CD="ICD9:962.6" CONCEPT_PATH="\EK\ICD9:Diagnoses\ICD9:800-999\ICD9:960-989\ICD9:962\ICD9:962.6\" NAME_CHAR="Poisoning by parathyroid hormone or parathyroid derivative NOS" UPDATE_DATE="1970-02-15" DOWNLOAD_DATE="1970-02-15" IMPORT_DATE="2015-05-07" SOURCESYSTEM_CD="edu.emory.cci.aiw.i2b2etl.ksb.I2b2KnowledgeSourceB"/>
  <EK_TEMP_CONCEPT CONCEPT_CD="ICD9:943.4" CONCEPT_PATH="\EK\ICD9:Diagnoses\ICD9:800-999\ICD9:940-949\ICD9:943\ICD9:943.4\" NAME_CHAR="Deep necrosis of underlying tissues due to burn (deep third degree) of upper limb, except wrist and hand, without mention of loss of a body part" UPDATE_DATE="1970-02-15" DOWNLOAD_DATE="1970-02-15" IMPORT_DATE="2015-05-07" SOURCESYSTEM_CD="edu.emory.cci.aiw.i2b2etl.ksb.I2b2KnowledgeSourceB"/>
  <EK_TEMP_CONCEPT CONCEPT_CD="ICD9:651.51" CONCEPT_PATH="\EK\ICD9:Diagnoses\ICD9:630-677\ICD9:651\ICD9:651.5\ICD9:651.51\" NAME_CHAR="Quadruplet pregnancy with fetal loss and retention of one or more fetus(es), delivered, with or without mention of antepartum condition" UPDATE_DATE="1970-02-15" DOWNLOAD_DATE="1970-02-15" IMPORT_DATE="2015-05-07" SOURCESYSTEM_CD="edu.emory.cci.aiw.i2b2etl.ksb.I2b2KnowledgeSourceB"/>
  <EK_TEMP_CONCEPT CONCEPT_CD="ICD9:646.51" CONCEPT_PATH="\EK\ICD9:Diagnoses\ICD9:630-677\ICD9:646\ICD9:646.5\ICD9:646.51\" NAME_CHAR="Asymptomatic bacteriuria in pregnancy, with delivery" UPDATE_DATE="1970-02-15" DOWNLOAD_DATE="1970-02-15" IMPORT_DATE="2015-05-07" SOURCESYSTEM_CD="edu.emory.cci.aiw.i2b2etl.ksb.I2b2KnowledgeSourceB"/>
  <EK_TEMP_CONCEPT CONCEPT_CD="ICD9:653.20" CONCEPT_PATH="\EK\ICD9:Diagnoses\ICD9:630-677\ICD9:653\ICD9:653.2\ICD9:653.20\" NAME_CHAR="Inlet contraction of pelvis, unspecified as to episode of care in pregnancy" UPDATE_DATE="1970-02-15" DOWNLOAD_DATE="1970-02-15" IMPORT_DATE="2015-05-07" SOURCESYSTEM_CD="edu.emory.cci.aiw.i2b2etl.ksb.I2b2KnowledgeSourceB"/>